{
    "task_id":  "trade-demo-001",
    "model_id":  "model-a",
    "task_contract":  [
                          {
                              "id":  "req-scale-metric",
                              "text":  "规模指标为出口额",
                              "kind":  "required",
                              "status":  "covered",
                              "evidence_refs":  [
                                                    "report:a:p1"
                                                ],
                              "quoted_evidence":  "出口额",
                              "reason":  "最终交付实际给出出口额结果"
                          },
                          {
                              "id":  "req-scale-unit",
                              "text":  "规模结果单位为百万美元",
                              "kind":  "required",
                              "status":  "covered",
                              "evidence_refs":  [
                                                    "report:a:p1"
                                                ],
                              "quoted_evidence":  "百万美元",
                              "reason":  "单位可由任务上下文与最终数值结合解析"
                          },
                          {
                              "id":  "req-scale-result",
                              "text":  "给出 2025 年中国 HS0901 咖啡全球出口规模结果",
                              "kind":  "required",
                              "status":  "covered",
                              "evidence_refs":  [
                                                    "report:a:p1"
                                                ],
                              "quoted_evidence":  "120 百万美元",
                              "reason":  "实际给出请求结果，正确性由 J2 判断"
                          },
                          {
                              "id":  "req-comparison-period",
                              "text":  "同比比较 2024 年基期",
                              "kind":  "required",
                              "status":  "covered",
                              "evidence_refs":  [
                                                    "report:a:p1"
                                                ],
                              "quoted_evidence":  "2024 年同期",
                              "reason":  "给出比较时期"
                          },
                          {
                              "id":  "req-change-result",
                              "text":  "给出同比变化结果",
                              "kind":  "required",
                              "status":  "covered",
                              "evidence_refs":  [
                                                    "report:a:p1"
                                                ],
                              "quoted_evidence":  "同比 20%",
                              "reason":  "实际给出变化结果，正确性由 J2 判断"
                          },
                          {
                              "id":  "req-trend-conclusion",
                              "text":  "给出增长或下降的趋势结论",
                              "kind":  "required",
                              "status":  "covered",
                              "evidence_refs":  [
                                                    "report:a:p1"
                                                ],
                              "quoted_evidence":  "同比增长 20%",
                              "reason":  "实际给出趋势结论"
                          },
                          {
                              "id":  "cond-degrade-actual",
                              "text":  "发生数据缺失或降级时披露实际处理口径",
                              "kind":  "conditional",
                              "triggered":  true,
                              "trigger_evidence_refs":  [
                                                            "trace:a:missing"
                                                        ],
                              "status":  "covered",
                              "evidence_refs":  [
                                                    "report:a:note"
                                                ],
                              "quoted_evidence":  "缺失月份沿用上月",
                              "reason":  "过程触发，最终披露处理口径"
                          },
                          {
                              "id":  "cond-degrade-reason",
                              "text":  "发生数据缺失或降级时披露原因",
                              "kind":  "conditional",
                              "triggered":  true,
                              "trigger_evidence_refs":  [
                                                            "trace:a:missing"
                                                        ],
                              "status":  "covered",
                              "evidence_refs":  [
                                                    "report:a:note"
                                                ],
                              "quoted_evidence":  "个别月份原始值缺失",
                              "reason":  "过程触发，最终披露原因"
                          },
                          {
                              "id":  "cond-degrade-limit",
                              "text":  "发生数据缺失或降级时披露限制",
                              "kind":  "conditional",
                              "triggered":  true,
                              "trigger_evidence_refs":  [
                                                            "trace:a:missing"
                                                        ],
                              "status":  "covered",
                              "evidence_refs":  [
                                                    "report:a:note"
                                                ],
                              "quoted_evidence":  "连续性可比受限",
                              "reason":  "过程触发，最终披露限制"
                          },
                          {
                              "id":  "cond-degrade-impact",
                              "text":  "发生数据缺失或降级时披露结论影响",
                              "kind":  "conditional",
                              "triggered":  true,
                              "trigger_evidence_refs":  [
                                                            "trace:a:missing"
                                                        ],
                              "status":  "partial",
                              "evidence_refs":  [
                                                    "report:a:note"
                                                ],
                              "quoted_evidence":  "趋势结论需谨慎",
                              "reason":  "过程触发，最终仅笼统提示影响"
                          }
                      ],
    "irrelevant_extensions":  [

                              ]
}